[
  {
    "name": "OpenAI Codex",
    "slug": "openai-codex",
    "category": "official-platform",
    "status": "official",
    "auth": [
      "Sign in with ChatGPT",
      "OpenAI API key"
    ],
    "subscription_auth_support": "Codex can be used through ChatGPT subscription access on supported ChatGPT plans, or with API-key billing.",
    "description": "OpenAI coding agent available as CLI, IDE integrations, web, desktop, and cloud tasks.",
    "url": "https://github.com/openai/codex",
    "docs": [
      "https://developers.openai.com/codex/auth",
      "https://developers.openai.com/codex/cli"
    ],
    "notes": "Use this as the baseline reference for what “ChatGPT subscription auth” means in the Codex ecosystem.",
    "last_verified": "2026-06-02"
  },
  {
    "name": "Codex App Server",
    "slug": "codex-app-server",
    "category": "official-platform",
    "status": "official",
    "auth": [
      "ChatGPT managed auth",
      "Device-code auth",
      "OpenAI API key"
    ],
    "subscription_auth_support": "Provides local agent runtime/app-server primitives that can authenticate through ChatGPT-managed auth modes.",
    "description": "Protocol/runtime used by apps to run Codex-backed coding agents with managed authentication, tools, and events.",
    "url": "https://developers.openai.com/codex/app-server",
    "docs": [
      "https://developers.openai.com/codex/app-server"
    ],
    "notes": "Important infrastructure layer behind many “Sign in with ChatGPT” agent integrations.",
    "last_verified": "2026-06-02"
  },
  {
    "name": "Codex IDE integrations",
    "slug": "codex-ide-integrations",
    "category": "official-platform",
    "status": "official",
    "auth": [
      "Sign in with ChatGPT",
      "OpenAI API key",
      "JetBrains AI subscription where supported"
    ],
    "subscription_auth_support": "OpenAI documents ChatGPT sign-in for Codex IDE integrations.",
    "description": "Official Codex integrations for supported IDEs and editor workflows.",
    "url": "https://developers.openai.com/codex/ide",
    "docs": [
      "https://developers.openai.com/codex/ide"
    ],
    "notes": "Exact feature set varies by IDE and integration.",
    "last_verified": "2026-06-02"
  },
  {
    "name": "Codex GitHub integration",
    "slug": "codex-github-integration",
    "category": "official-platform",
    "status": "official",
    "auth": [
      "ChatGPT/Codex account connection"
    ],
    "subscription_auth_support": "Codex can review code and work with GitHub repositories from the Codex product surface.",
    "description": "Official Codex integration for GitHub code review and repository workflows.",
    "url": "https://developers.openai.com/codex/integrations/github",
    "docs": [
      "https://developers.openai.com/codex/integrations/github"
    ],
    "notes": "Useful to include because many third-party tools are trying to replicate or extend this workflow.",
    "last_verified": "2026-06-02"
  },
  {
    "name": "Codex plugin for Claude Code",
    "slug": "codex-plugin-cc",
    "category": "official-platform",
    "status": "official",
    "auth": [
      "Local Codex sign-in",
      "ChatGPT subscription",
      "OpenAI API key"
    ],
    "subscription_auth_support": "Delegates selected Claude Code work to local Codex, using the user’s existing Codex authentication.",
    "description": "OpenAI plugin that lets Claude Code call Codex for reviews, delegation, and related workflows.",
    "url": "https://github.com/openai/codex-plugin-cc",
    "docs": [
      "https://github.com/openai/codex-plugin-cc"
    ],
    "notes": "Requires Claude Code plus local Codex setup.",
    "last_verified": "2026-06-02"
  },
  {
    "name": "Xcode coding intelligence",
    "slug": "xcode-codex",
    "category": "editors-agents",
    "status": "documented-third-party",
    "auth": [
      "Sign in with a ChatGPT account",
      "OpenAI API key"
    ],
    "subscription_auth_support": "Apple documents Codex setup with ChatGPT account sign-in or API key.",
    "description": "Apple Xcode coding intelligence and agent workflows with Codex support.",
    "url": "https://developer.apple.com/documentation/Xcode/setting-up-coding-intelligence",
    "docs": [
      "https://developer.apple.com/documentation/Xcode/setting-up-coding-intelligence"
    ],
    "notes": "Requires supported Xcode versions and regional/account availability.",
    "last_verified": "2026-06-02"
  },
  {
    "name": "JetBrains IDEs / AI Assistant Codex",
    "slug": "jetbrains-codex",
    "category": "editors-agents",
    "status": "documented-third-party",
    "auth": [
      "ChatGPT account",
      "OpenAI API key",
      "JetBrains AI subscription"
    ],
    "subscription_auth_support": "JetBrains documents Codex usage via ChatGPT account, OpenAI API key, or JetBrains AI subscription.",
    "description": "Codex integration for IntelliJ IDEA, PyCharm, WebStorm, and other JetBrains IDEs.",
    "url": "https://www.jetbrains.com/help/ai-assistant/codex-agent.html",
    "docs": [
      "https://blog.jetbrains.com/ai/2026/01/codex-in-jetbrains-ides/",
      "https://www.jetbrains.com/help/ai-assistant/codex-agent.html"
    ],
    "notes": "Feature availability may differ between IDEs and JetBrains AI plans.",
    "last_verified": "2026-06-02"
  },
  {
    "name": "Zed",
    "slug": "zed-chatgpt-subscription",
    "category": "editors-agents",
    "status": "documented-third-party",
    "auth": [
      "ChatGPT subscription",
      "OpenAI API key"
    ],
    "subscription_auth_support": "Zed documents signing in with a ChatGPT account and running OpenAI models through Zed’s agent with Codex usage.",
    "description": "Code editor with built-in agent workflows and ChatGPT subscription/Codex support.",
    "url": "https://zed.dev/blog/chatgpt-subscription-in-zed",
    "docs": [
      "https://zed.dev/docs/ai/external-agents",
      "https://github.com/zed-industries/codex-acp"
    ],
    "notes": "Remote-project support and billing behavior may differ from local projects.",
    "last_verified": "2026-06-02"
  },
  {
    "name": "OpenCode",
    "slug": "opencode",
    "category": "editors-agents",
    "status": "documented-third-party",
    "auth": [
      "OpenAI login",
      "ChatGPT Plus/Pro",
      "OpenAI API key through providers"
    ],
    "subscription_auth_support": "OpenCode documents connecting OpenAI and selecting ChatGPT Plus/Pro.",
    "description": "Open-source terminal coding agent with multiple model providers and OpenAI subscription login support.",
    "url": "https://opencode.ai/",
    "docs": [
      "https://opencode.ai/docs/providers/"
    ],
    "notes": "Also has third-party Codex-auth plugins listed below.",
    "last_verified": "2026-06-02"
  },
  {
    "name": "Cline",
    "slug": "cline-openai-codex-oauth",
    "category": "editors-agents",
    "status": "documented-third-party",
    "auth": [
      "OpenAI Codex OAuth",
      "ChatGPT Plus/Pro",
      "OpenAI API key through other providers"
    ],
    "subscription_auth_support": "Cline documents OpenAI Codex OAuth: sign in with OpenAI, no API key required, with model access depending on plan.",
    "description": "VS Code AI coding assistant with OpenAI Codex OAuth support.",
    "url": "https://cline.bot/",
    "docs": [
      "https://docs.cline.bot/provider-config/openai",
      "https://cline.bot/blog/introducing-openai-codex-oauth"
    ],
    "notes": "Availability and model list can change with Cline and OpenAI plan updates.",
    "last_verified": "2026-06-02"
  },
  {
    "name": "Roo Code",
    "slug": "roo-code-openai-chatgpt-plus-pro",
    "category": "editors-agents",
    "status": "documented-third-party",
    "auth": [
      "OpenAI - ChatGPT Plus/Pro OAuth"
    ],
    "subscription_auth_support": "Roo Code documents an OpenAI – ChatGPT Plus/Pro provider using OAuth, without an API key.",
    "description": "Agentic coding extension with a ChatGPT Plus/Pro provider.",
    "url": "https://roocode.com/",
    "docs": [
      "https://docs.roocode.com/providers/openai-chatgpt-plus-pro"
    ],
    "notes": "Use provider docs to confirm current model availability and plan requirements.",
    "last_verified": "2026-06-02"
  },
  {
    "name": "Kilo Code",
    "slug": "kilo-code-openai-chatgpt-plus-pro",
    "category": "editors-agents",
    "status": "documented-third-party",
    "auth": [
      "OpenAI - ChatGPT Plus/Pro OAuth"
    ],
    "subscription_auth_support": "Kilo Code documents using a ChatGPT Plus/Pro subscription with OAuth and no separate API key.",
    "description": "AI coding agent/extension with OpenAI ChatGPT Plus/Pro provider support.",
    "url": "https://kilo.ai/",
    "docs": [
      "https://kilo.ai/docs/ai-providers/openai-chatgpt-plus-pro"
    ],
    "notes": "Docs note usage counts against subscription limits and that some Kilo products may not support this provider.",
    "last_verified": "2026-06-02"
  },
  {
    "name": "Pi",
    "slug": "pi-coding-agent",
    "category": "editors-agents",
    "status": "documented-third-party",
    "auth": [
      "ChatGPT Plus/Pro (Codex)",
      "Other subscription logins"
    ],
    "subscription_auth_support": "Pi documents ChatGPT Plus/Pro (Codex) as a login provider for its coding agent.",
    "description": "Composable AI agent/coding-agent toolkit with subscription login providers.",
    "url": "https://github.com/earendil-works/pi",
    "docs": [
      "https://github.com/earendil-works/pi/blob/main/packages/coding-agent/docs/providers.md",
      "https://pi.dev/news"
    ],
    "notes": "Stores local auth state; review docs before using on shared machines.",
    "last_verified": "2026-06-02"
  },
  {
    "name": "OpenClaw",
    "slug": "openclaw",
    "category": "editors-agents",
    "status": "documented-third-party",
    "auth": [
      "OpenAI/Codex OAuth",
      "ChatGPT subscription",
      "OpenAI API key"
    ],